date_disclosed,country,ifc_country_code,sector,project_name,project_number,company_name,status,ifc_investment_for_risk_management_million_usd,ifc_investment_for_guarantee_million_usd,ifc_investment_for_loan_million_usd,ifc_investment_for_equity_million_usd,total_ifc_investment_as_approved_by_board_million_usd
19.12.13,Guyana,GUY,"Oil, Gas, and Mining",Aurora Gold,34228,Guyana Goldfields Inc,Completed,5,NA,50,10,65
18.12.13,Sri Lanka,SRI,Financial Institutions,SFCL Senior Loan,33889,SENKADAGALA FINANCE PLC,Completed,NA,NA,7,NA,7
16.12.13,World Region,WLD,Funds,Abraaj Global Health Fund,33475,ABRAAJ GROWTH MARKETS HEALTH FUND LP,Active,NA,NA,NA,150,150
16.12.13,Zambia,ZAM,Financial Institutions,Bayport Zambia,33794,BAYPORT FINANCIAL SERVICES ZAMBIA LIMITED,Completed,NA,NA,10.76,NA,10.76
13.12.13,Jamaica,JAM,"Telecommunications, Media, and Technology",Facey Group II,33791,FACEY GROUP LIMITED,Active,NA,NA,NA,20,20
13.12.13,Senegal,SEN,Agribusiness and Forestry,"Societe Industrielle Agroalimentaire S.A.(""SIAGRO"")",33844,SOCIETE INDUSTRIELLE AGRO-ALIMENTAIRE S.A,Active,NA,NA,6.88,NA,6.88
12.12.13,East Asia and Pacific Region,EAP,Manufacturing,ZincOx,33722,ZINCOX RESOURCES PLC,Completed,NA,NA,NA,8,8
06.12.13,China,CHA,Agribusiness and Forestry,Hekangyuan Poultry Breeding,33944,SHANDONG HEKANGYUAN POULTRY BREEDING INC LTD,Active,NA,NA,NA,10,10
04.12.13,Africa Region,AFR,Infrastructure,Investec Africa Private Equity Fund 2,33017,INVESTEC AFRICA PRIVATE EQUITY FUND 2 GP L.P.,Active,NA,NA,NA,30,30
02.12.13,China,CHA,Financial Institutions,MicroCred China RMB Ln,33780,MicroCred China Limited,Pending Approval,NA,NA,14.51,NA,14.51
27.11.13,Brazil,BRA,Infrastructure,AEGEA Equity,33239,Aegea Saneamento e Participações S/A.,Active,NA,NA,NA,5,5
27.11.13,Burkina Faso,BUR,"Tourism, Retail, and Property",Marina Mkt BKF 2,34527,MARINA MARKET SARL,Active,NA,NA,1.09,NA,1.09
25.11.13,Russian Federation,RUS,Health and Education,Helix Lab,32926,HELIX LABORATORY SERVICE,Completed,NA,NA,4.5,NA,4.5
25.11.13,Russian Federation,RUS,Financial Institutions,Working Capital & Systemic Solutions CIB,33860,"TSENTR-INVEST, OAO KB",Completed,NA,NA,16.99,NA,16.99
22.11.13,China,CHA,Agribusiness and Forestry,Stora China III,27286,Stora Enso Pulp And Paper Asia AB,Active,NA,NA,88.07,58.9,146.97
20.11.13,Peru,PER,Financial Institutions,Confianza II,32273,FINANCIERA CONFIANZA S.A.A.,Active,NA,NA,17.75,NA,17.75
20.11.13,India,IND,Manufacturing,Flexituff,33525,Flexituff International Limited,Active,NA,NA,9,7.2,16.2
20.11.13,Mexico,MXC,"Telecommunications, Media, and Technology",VMLA - Mexico,33958,VIRGIN MOBILE MEXICO S. DE R.L. DE C.V.,Active,NA,NA,12.5,NA,12.5
18.11.13,Belarus,BLR,Financial Institutions,Belarusky Narodny Bank II,34287,BELARUSKY NARODNY BANK,Completed,NA,NA,7,NA,7
18.11.13,Southern Asia Region,SAS,"Oil, Gas, and Mining",Niko,34359,Niko Resources Ltd,Active,NA,NA,70,10,80
18.11.13,Cambodia,KAM,Financial Institutions,ACLEDA loan 2013,34386,ACLEDA BANK PLC.,Active,NA,NA,50,NA,50
18.11.13,Russian Federation,RUS,"Telecommunications, Media, and Technology",De Novo Cloud,34467,DENOVO OVERSEAS HOLDINGS LIMITED,Completed,NA,NA,1,NA,1
15.11.13,Ukraine,UKR,Agribusiness and Forestry,IMC Ukraine,31711,INDUSTRIAL MILK COMPANY S.A.,Active,NA,NA,30,20,50
14.11.13,Turkey,TUR,Agribusiness and Forestry,Tiryaki II,34061,TIRYAKI AGRO GIDA SANAYI VE TICARET ANONIM SIRKETI,Completed,NA,NA,40,NA,40
13.11.13,Mongolia,MNG,Health and Education,Intermed,33808,INTERNATIONAL MEDICAL CENTRE LLC,Active,NA,NA,10,NA,10
12.11.13,Myanmar,BUA,"Tourism, Retail, and Property",SL Myanmar,33127,SHANGRI-LA YANGON COMPANY LIMITED,Active,NA,NA,80,NA,80
12.11.13,Nigeria,NIR,Financial Institutions,Grooming MF Loan,33824,GROOMING PEOPLE FOR BETTER LIVELIHOOD CENTRE,Active,NA,NA,4.1,NA,4.1
12.11.13,Eastern Europe Region,EER,"Telecommunications, Media, and Technology",Virgin Mobile Central & Eastern Europe,34291,Virgin Mobile Central and Eastern Europe (BeMyMobile Ltd.),Active,NA,NA,NA,13.83,13.83
11.11.13,Ukraine,UKR,Agribusiness and Forestry,Mriya IV,34104,"MRIYa Agrokholdyng, TOV",Active,NA,NA,65,NA,65
11.11.13,Nicaragua,NIC,Financial Institutions,BDF Sub-Debt,34131,Banco de Finanzas SA,Active,NA,NA,3.75,NA,3.75
08.11.13,El Salvador,ESL,Financial Institutions,Davivienda El Salvador,32964,BANCO DAVIVIENDA SALVADORENO SA DE CV,Active,NA,NA,50,NA,50
08.11.13,West Bank and Gaza,XOT,Manufacturing,Palestine Growth Capital Fund,34190,The Palestine Growth Capital Fund C.V.,Completed,NA,NA,NA,5,5
06.11.13,Colombia,CLM,"Oil, Gas, and Mining",El Dovio,34112,Colombian Mines Corporation,Completed,NA,NA,NA,5.19,5.19
05.11.13,Central America Region,XCN,Health and Education,Central America Mezzanine Infrastructure Fund II,32338,CENTRAL AMERICAN MEZZANINE INFRASTRUCTURE FUND II LP,Active,NA,NA,12.5,17.5,30
05.11.13,Georgia,GEO,Financial Institutions,BoG Subdebt,34173,JSC BANK OF GEORGIA,Active,NA,NA,NA,NA,NA
05.11.13,South Africa,SOU,Manufacturing,CLN South Africa,34366,MA AUTOMOTIVE ROSSLYN (PTY) LTD,Active,NA,NA,NA,27.32,27.32
05.11.13,India,IND,Financial Institutions,Yes Bank II,34478,YES BANK LIMITED,Active,NA,NA,60,NA,60
04.11.13,Ukraine,UKR,Manufacturing,Nadezhda LPG,33985,"KOMPANIYA NADEZHDA, PP",Active,NA,NA,15,NA,15
01.11.13,South Africa,SOU,Financial Institutions,Project Leo,30460,RESIDUAL DEBT SERVICES LIMITED,Completed,NA,NA,100,100,200
01.11.13,Vietnam,VNM,"Tourism, Retail, and Property",Thien Minh II,33350,THIEN MINH TRAVEL JOINT STOCK COMPANY,Active,NA,NA,NA,14,14
01.11.13,China,CHA,Agribusiness and Forestry,Muyuan Loan 2,33505,"MUYUAN FOOD CO., LTD.",Completed,NA,NA,20.51,NA,20.51
01.11.13,Brazil,BRA,Financial Institutions,Banco Caixa Geral - Brasil SEF,34094,Banco Caixa Geral - Brasil S A.,Completed,NA,NA,29.94,NA,29.94
31.10.13,Turkey,TUR,Manufacturing,Sisecam Bond,33711,TURKIYE SISE VE CAM FABRIKALARI ANONIM SIRKETI,Active,NA,NA,75,NA,75
30.10.13,Kenya,KEN,Health and Education,Bridge International Academies,32171,NEWGLOBE SCHOOLS INC,Active,NA,NA,NA,10,10
30.10.13,El Salvador,ESL,Financial Institutions,FDC II,33879,Federacion de Cajas de Credito y de Bancos de los Trabajadores SC de RL,Active,NA,NA,20,NA,20
29.10.13,Chile,CHL,Financial Institutions,BICE RE,33707,Banco Bice,Active,NA,NA,75,NA,75
28.10.13,Guinea,GUI,Financial Institutions,Banque Internationale pour le Commerce et l'Industrie de la Guinee,33502,RISK SHARING FACILITY BICIGUI,Active,NA,2.49,NA,NA,2.49
28.10.13,India,IND,Financial Institutions,Gaja II,33897,GAJA CAPITAL FUND II LIMITED,Active,NA,NA,NA,25,25
25.10.13,Romania,ROM,Manufacturing,Timisoara Muni,31884,MUNICIPALITY OF TIMISOARA,Active,NA,NA,46.71,NA,46.71
25.10.13,Romania,ROM,"Telecommunications, Media, and Technology",TeamNet Romania,32630,S.C. TEAMNET INTERNATIONAL SA,Active,NA,NA,13.61,6.8,20.41
25.10.13,Turkey,TUR,"Telecommunications, Media, and Technology",Logo,33645,LOGO YAZILIM SANAYI VE TICARET ANONIM SIRKETI,Active,NA,NA,9.81,2.7,12.51
25.10.13,Mexico,MXC,Financial Institutions,Capital Indigo,34031,INDIGO 1 FICAP,Active,NA,NA,NA,10,10
24.10.13,Turkey,TUR,Infrastructure,Mersin Port,33943,MERSIN ULUSLARARASI LIMAN ISLETMECILIGI ANONIM SIRKETI,Active,NA,NA,75,NA,75
23.10.13,China,CHA,Agribusiness and Forestry,Sinofarm,34001,"Beijing SinoFarm Stud Livestock Co., Ltd.",Pending Approval,NA,NA,20,10,30
21.10.13,Latin America Region,LAC,Health and Education,MD Radiation,33449,"Medical Developers, LLC",Completed,NA,NA,5,NA,5
21.10.13,Country Name Pending,NA,Financial Institutions,Sesame MSME Financing Package,34023,Company Name Pending,Completed,NA,NA,250,NA,250
18.10.13,Colombia,CLM,Financial Institutions,MovilRed,33942,TRANZA S.A.S,Active,NA,NA,NA,10,10
18.10.13,Nepal,NEP,Infrastructure,Kabeli,30977,KABELI ENERGY LIMITED,Hold,NA,NA,19.3,NA,19.3
15.10.13,Mexico,MXC,Agribusiness and Forestry,Acuagranjas Exp.,34073,"Acuagranjas dos Lagos, S.A. de C.V.",Completed,NA,NA,10,NA,10
11.10.13,Philippines,PHL,Financial Institutions,RCBC Short Term,34115,RIZAL COMMERCIAL BANKING CORPORATION,Completed,NA,NA,30,NA,30
10.10.13,Brazil,BRA,Infrastructure,Enel Wind Brazil,33579,ENEL GREEN POWER BRASIL PARTICIPACOES LTDA.,Active,NA,NA,200,NA,200
08.10.13,Mexico,MXC,Infrastructure,APM TEC II,31939,APM TERMINALS LAZARO CARDENAS S.A. DE C.V.,Active,NA,NA,100,NA,100
07.10.13,Turkey,TUR,Agribusiness and Forestry,Chipita Turkey,32940,CHIPITA GIDA URETIM ANONIM SIRKETI,Completed,NA,NA,14.63,NA,14.63
07.10.13,Eastern Africa Region,EAN,Financial Institutions,Kibo Fund II,32989,THE KIBO FUND II LLC,Active,NA,NA,NA,12.5,12.5
03.10.13,Georgia,GEO,Infrastructure,Adjaristsqali Georgia LLC,33435,Adjaristsqali Georgia LLC(Limited liability Company),Active,NA,NA,71,34,105
27.09.13,Kyrgyz Republic,KGZ,Financial Institutions,KICB MSME2,32741,Kyrgyz Investment and Credit Bank CJSC,Completed,NA,NA,10,NA,10
27.09.13,Paraguay,PAR,"Oil, Gas, and Mining",President Energy,33842,PRESIDENT ENERGY PLC,Active,NA,NA,NA,24.04,24.04
25.09.13,Ukraine,UKR,Manufacturing,GNG Syndicate,33721,"Kontsern Galnaftogaz, Publichne AT",Active,NA,NA,15,NA,15
25.09.13,Nigeria,NIR,"Tourism, Retail, and Property",Jabi Lake Mall,33877,ACTIS JABI LAKE MALL DEVELOPMENT COMPANY LIMITED,Active,NA,NA,9,1,10
20.09.13,MENA Region,EMN,Infrastructure,ACWA Equity,33736,INTERNATIONAL COMPANY FOR WATER AND POWER PROJECTS,Active,NA,NA,NA,99.99,99.99
20.09.13,Turkey,TUR,Manufacturing,Cimko Cement II,33753,CIMKO CIMENTO VE BETON SANAYI TICARET ANONIM SIRKETI,Active,NA,NA,40,NA,40
18.09.13,Country Name Pending,NA,Manufacturing,RF Project,33426,Company Name Pending,Hold,NA,NA,NA,NA,NA
12.09.13,Russian Federation,RUS,Financial Institutions,NBD SME Loan2013,33859,PUBLIC JOINT STOCK COMPANY NBD BANK,Completed,NA,NA,13.7,NA,13.7
06.09.13,Nigeria,NIR,Financial Institutions,ABN MF Bank Loan,33591,AB MICROFINANCE BANK NIGERIA,Completed,NA,NA,5,NA,5
05.09.13,Nigeria,NIR,Infrastructure,Azura Edo IPP,32859,AZURA POWER WEST AFRICA LTD,Active,NA,NA,155,NA,155
04.09.13,Morocco,MYC,Financial Institutions,FBPMC,33262,Attawfiq Micro-Finance,Active,NA,NA,20,NA,20
04.09.13,Gabon,GAB,"Oil, Gas, and Mining",VAALCO III,33781,"VAALCO GABON (ETAME), INC.,",Completed,NA,NA,65,NA,65
29.08.13,Russian Federation,RUS,Manufacturing,Borets II,34065,BORETS INTERNATIONAL LTD,Active,NA,NA,NA,18,18
28.08.13,Panama,PAN,Financial Institutions,QBE Equity 2,34052,ISTMO COMPANIA DE REASEGUROS INC,Active,NA,NA,NA,4.5,4.5
27.08.13,Nicaragua,NIC,Financial Institutions,FDL Nicaragua,28799,FONDO DE DESARROLLO LOCAL,Completed,NA,NA,5,NA,5
27.08.13,Indonesia,INS,Financial Institutions,Danamon SME,32311,"BANK DANAMON INDONESIA, PT TBK",Completed,NA,NA,75,NA,75
27.08.13,Mongolia,MNG,Financial Institutions,Khan Bank AMC Cap Fund,33515,KHAN BANK LLC,Active,NA,NA,NA,NA,NA
27.08.13,Mexico,MXC,Agribusiness and Forestry,Puertas Finas II,33550,"PUERTAS FINAS DE MADERA MONTEALBAN, S.A. DE C.V.",Active,NA,NA,13,NA,13
26.08.13,Dominican Republic,DOM,Financial Institutions,FONDESA Gender F,33857,"FONDO PARA EL DESARROLLO, INC. - FONDESA",Completed,NA,NA,4.69,NA,4.69
22.08.13,Pakistan,PAK,Infrastructure,Metro Power Company Limited,33496,METRO POWER COMPANY LIMITED,Active,NA,NA,22.5,3.26,25.76
16.08.13,Brazil,BRA,Agribusiness and Forestry,Asa Alimentos,32759,ASA PARTICIPACOES E ADMINISTRACAO LTDA.,Active,NA,NA,19.72,NA,19.72
16.08.13,Russian Federation,RUS,Financial Institutions,TCB EE Loan,33690,OAO TRANSKAPITALBANK,Completed,NA,NA,50,NA,50
15.08.13,World Region,WLD,Manufacturing,Fluidic,33274,"FLUIDIC, INC.",Active,NA,NA,NA,7,7
13.08.13,Tajikistan,TJK,Financial Institutions,FINCA Tajikistan,33453,MICROCREDIT DEPOSIT ORGANIZATION FINCA LIMITED LIABILITY COMPANY,Completed,NA,NA,1.5,NA,1.5
02.08.13,Turkey,TUR,Health and Education,Astra Dorms,33528,ASTRA YAPI VE ISLETMECILIGI SANAYI VE TICARET ANONIM SIRKETI,Active,NA,NA,NA,10.27,10.27
02.08.13,Romania,ROM,Infrastructure,Botosani Heating,33606,MUNICIPALITY BOTOSANI,Completed,NA,NA,10,NA,10
02.08.13,Turkey,TUR,Health and Education,OzU II,34009,OZYEGIN UNIVERSITESI,Completed,NA,NA,25,NA,25
31.07.13,Turkey,TUR,Financial Institutions,Seker Sub,33922,SEKERBANK TAS,Completed,NA,NA,50,NA,50
30.07.13,Jordan,JOR,Financial Institutions,FINCA Jordan,31217,FINCA JORDAN,Completed,NA,NA,2,NA,2
30.07.13,Uzbekistan,UZB,Financial Institutions,Hamkor Bank SL,33596,HAMKORBANK JSCB,Completed,NA,NA,7.5,NA,7.5
29.07.13,Chile,CHL,Infrastructure,Alto Maipo,31632,Alto Maipo SpA,Completed,NA,NA,150,NA,150
22.07.13,Colombia,CLM,Infrastructure,TCBuen II,32481,SOCIEDAD PORTUARIA TERMINAL DE CONTENEDORES DE BUENAVENTURA S A,Completed,NA,NA,25,NA,25
19.07.13,Philippines,PHL,Financial Institutions,Altus,31942,ACP Investments One Inc.,Active,NA,NA,41.17,0.15,41.32
19.07.13,Mexico,MXC,Financial Institutions,CS Mexico Credit Opportunities Trust,32407,CREDIT SUISSE MEXICO OPPORTUNITIES TRUST,Active,NA,NA,NA,50,50
19.07.13,Russian Federation,RUS,Manufacturing,KuAz Expansion,33302,KUIBYSHEVAZOT PAO,Active,NA,NA,75,NA,75
17.07.13,Morocco,MYC,Agribusiness and Forestry,Zalagh,32390,ZALAR HOLDING SA,Active,NA,NA,NA,24,24
09.07.13,Colombia,CLM,Financial Institutions,CF Amalia sub-debt Colombia,32916,ITAU CORPBANCA COLOMBIA SA,Active,NA,NA,42.5,NA,42.5
08.07.13,Africa Region,AFR,"Oil, Gas, and Mining",Delonex Energy,33557,DELONEX ENERGY UK LIMITED,Active,NA,NA,NA,60,60
08.07.13,Russian Federation,RUS,"Telecommunications, Media, and Technology",Lamoda Russia,34026,Lamoda GmbH,Completed,NA,NA,NA,13.24,13.24
02.07.13,Cote d'Ivoire,IVC,Financial Institutions,GTST SIR,33538,RISK SHARING FACILITY SOCIÉTÉ IVOIRIENNE DE RAFFINAGE,Completed,NA,50,50,NA,100
01.07.13,Uganda,UAN,Infrastructure,Umeme Capex,33500,UMEME LTD,Active,NA,NA,70,NA,70
24.06.13,Cote d'Ivoire,IVC,Infrastructure,Ciprel IV,31833,COMPAGNIE IVOIRIENNE DE PRODUCTION D'ELECTRICITE,Active,NA,NA,132.54,NA,132.54
21.06.13,Romania,ROM,Financial Institutions,UniCredit Rom,33733,UNICREDIT BANK SA,Active,NA,NA,74.98,NA,74.98
20.06.13,Mexico,MXC,Financial Institutions,E Factor Network,33270,"E Factor Network, S.A. de C.V.",Active,NA,NA,NA,5,5
19.06.13,Mexico,MXC,Financial Institutions,CAMESA II,33639,"Consejo de Asistencia al Microemprendedor, S.A. de C.V., S.F.",Completed,NA,NA,14.06,NA,14.06
17.06.13,Latin America Region,LAC,"Telecommunications, Media, and Technology",Dafiti Latam,33609,Dafiti Latam GmbH & Co. Beteiligungs KG,Completed,NA,NA,NA,19.6,19.6
11.06.13,MENA Region,EMN,Infrastructure,Renaissance MCB,33121,RENAISSANCE SERVICES SAOG,Completed,NA,NA,0,30,30
11.06.13,Senegal,SEN,Infrastructure,Tobene,33841,TOBENE POWER SA,Active,NA,NA,41.4,4.83,46.22
10.06.13,Turkey,TUR,Manufacturing,SOCAR Turkey Aegean Refinery,30867,STAR RAFINERI ANONIM SIRKETI,Hold,NA,NA,NA,NA,NA
07.06.13,Morocco,MYC,Financial Institutions,CF BCP Equity,31240,BANQUE CENTRALE POPULAIRE SA,Active,NA,NA,NA,62.04,62.04
06.06.13,Latin America Region,LAC,"Telecommunications, Media, and Technology",Seaborn,31388,SEABORN NETWORKS GROUP INC,Completed,NA,NA,NA,4,4
06.06.13,Cote d'Ivoire,IVC,Financial Institutions,SIB RSF,33230,RISK SHARING FACILITY SOCIETE IVOIRIENNE DE BANQUE S.A,Active,NA,20.82,NA,NA,20.82
04.06.13,MENA Region,EMN,Infrastructure,Mediterrania Capital II,33021,MEDITERRANIA CAPITAL II (SICAV) PLC,Active,NA,NA,NA,19.86,19.86
31.05.13,World Region,WLD,Financial Institutions,AllianceBernstein Next 50 Emerging Markets Project,30730,ALLIANCEBERNSTEIN NEXT 50 EMERGING MARKETS MANAGEMENT LLC,Active,NA,NA,NA,100,100
30.05.13,World Region,WLD,Health and Education,Coursera Equity,33599,"Coursera, Inc.",Active,NA,NA,NA,5,5
29.05.13,Iraq,IRQ,Infrastructure,Nafith Logistics Services PSC,32425,Nafith International Limited,Active,NA,NA,NA,5,5
29.05.13,Brazil,BRA,"Tourism, Retail, and Property",BHG,32797,Brazil Hospitality Group S.A,Completed,NA,NA,NA,24.37,24.37
29.05.13,World Region,WLD,Financial Institutions,Earthport,32942,EARTHPORT PLC,Completed,NA,NA,NA,10,10
28.05.13,Turkey,TUR,Financial Institutions,Odea Bank SME,32915,ODEA BANK ANONIM SIRKETI,Completed,NA,NA,50,NA,50
26.05.13,Uganda,UAN,Agribusiness and Forestry,Pearl Dairy,33405,PEARL DAIRY FARMS LTD,Completed,NA,NA,4,NA,4
24.05.13,Armenia,ARM,Financial Institutions,WCSS Inecobank ASLF,33520,INECOBANK CJSC,Completed,NA,NA,5,NA,5
24.05.13,Armenia,ARM,Financial Institutions,WCSS Unibank ASLF,33521,UNIBANK OJSC,Completed,NA,NA,5,NA,5
24.05.13,Ethiopia,ETH,Agribusiness and Forestry,africaJUICE,33523,Africajuice B.V.,Active,NA,NA,NA,3,3
24.05.13,World Region,WLD,"Tourism, Retail, and Property",IFC Global Financial Institutions Fund,33537,"IFC Financial Institutions Growth Fund, LP",Active,NA,NA,NA,200,200
23.05.13,Ethiopia,ETH,Agribusiness and Forestry,Velocity,32357,VELOCITY DAIRY PLC,Pending Approval,NA,NA,NA,6.93,6.93
22.05.13,Bangladesh,BAN,Manufacturing,DBL Group,31357,COLOR CITY LTD.,Active,NA,NA,10.5,NA,10.5
22.05.13,Colombia,CLM,"Telecommunications, Media, and Technology",Avantel LTE,33688,AVANTEL ACQUISITIONS LTD.,Active,NA,NA,NA,15,15
21.05.13,Chile,CHL,Infrastructure,La Huayca II,33192,SPS LA HUAYCA S.A.,Active,NA,NA,14.3,NA,14.3
20.05.13,Lao People's Democratic Republic,LAO,Health and Education,Essilao,32557,ESSILOR LAO COMPANY LIMITED,Active,NA,NA,20,NA,20
20.05.13,Turkey,TUR,Financial Institutions,Fiba Sub Loan,32669,FIBABANKA A S,Completed,NA,NA,40,NA,40
20.05.13,Chile,CHL,Infrastructure,SunEdison CAP,33191,Amanecer Solar SpA,Active,NA,NA,65,NA,65
20.05.13,China,CHA,Financial Institutions,BVCF III,33495,"BVCF III, L.P.",Active,NA,NA,NA,20,20
17.05.13,Brazil,BRA,Financial Institutions,Orange,33421,SUL AMERICA S/A,Completed,NA,NA,NA,197.6,197.6
17.05.13,Chile,CHL,Infrastructure,SunEdison Merchant,33456,San Andres SpA,Active,NA,NA,38,NA,38
15.05.13,"Egypt, Arab Republic of",EGT,Manufacturing,Elif Egypt,33338,ELIF PLASTIK AMBALAJ SANAYI VE TICARET ANONIM SIRKETI,Active,NA,NA,35.5,NA,35.5
14.05.13,Georgia,GEO,Agribusiness and Forestry,Tetri Qudi,32807,Tetri Kudi LLC(Limited liability Company),Completed,NA,NA,1.5,NA,1.5
14.05.13,India,IND,Agribusiness and Forestry,Parag Dairy,33134,Parag Milk Foods Limited,Active,NA,NA,15,NA,15
14.05.13,Eastern Africa Region,EAN,Health and Education,AAR Healthcare,33419,AAR HEALTH CARE HOLDINGS LIMITED,Active,NA,NA,NA,4,4
13.05.13,MENA Region,EMN,"Oil, Gas, and Mining",Circle Oil,32571,CIRCLE OIL PLC,Active,NA,NA,50,NA,50
13.05.13,Eastern Europe Region,EER,Financial Institutions,DARP APS,33235,"APS FUND BETA uzavreny investicni fond, a.s.",Active,NA,NA,26.48,0.66,27.14
12.05.13,MENA Region,EMN,"Oil, Gas, and Mining",Viking Services BV,32036,VIKING SERVICES BV,Completed,NA,NA,50,NA,50
10.05.13,Haiti,HAI,"Tourism, Retail, and Property",Marriott Haiti,32421,TURGEAU DEVELOPMENTS SA,Active,NA,NA,13.25,NA,13.25
10.05.13,Armenia,ARM,Financial Institutions,Finca Armenia,33625,FINCA UNIVERSAL CREDIT ORGANIZATION CJSC,Active,NA,NA,4,NA,4
08.05.13,India,IND,Health and Education,Fortis Healthcare Ltd,33057,FORTIS HEALTHCARE LIMITED,Completed,NA,NA,55,45,100
08.05.13,Kenya,KEN,"Tourism, Retail, and Property",Garden City Kenya,32887,ACTIS AFRICA REAL ESTATE FUND 2 LP,Active,NA,NA,37,8.2,45.2
07.05.13,Vietnam,VNM,Agribusiness and Forestry,Masan Consumer,32470,Masan Consumer Holding LLC,Hold,NA,NA,NA,NA,NA
07.05.13,Bosnia and Herzegovina,BIH,Manufacturing,SSL Bosnia III,33387,SISECAM SODA LUKAVAC DOO,Active,NA,NA,22,NA,22
07.05.13,China,CHA,Financial Institutions,Fullerton II,33410,FULLERTON CREDIT (CHONGQING) LTD.,Completed,NA,NA,30,NA,30
03.05.13,East Asia and Pacific Region,EAP,"Telecommunications, Media, and Technology",DARP Fortress,32539,Fortress IFC Asian Investment Holdings L.P.,Active,NA,NA,50,25,75
03.05.13,Brazil,BRA,"Oil, Gas, and Mining",Neo Gas,32938,NEOGAS DO BRASIL GAS NATURAL COMPRIMIDO S.A.,Completed,NA,NA,20,20,40
03.05.13,Paraguay,PAR,Financial Institutions,Vision CL PYG,33155,VISION BANCO S.A.E.C.A.,Completed,NA,NA,15,NA,15
03.05.13,Latin America Region,LAC,Financial Institutions,Safetypay,33253,"SAFTPAY, INC.",Active,NA,NA,NA,7,7
03.05.13,Timor-Leste,TMP,Financial Institutions,TRM Convertible Loan,33643,TUBA RAI METIN,Active,NA,NA,0.5,NA,0.5
02.05.13,Nepal,NEP,Financial Institutions,Nepal SREP,32545,NEPAL BANK LIMITED,Hold,NA,NA,NA,NA,NA
02.05.13,Israel,ISR,Agribusiness and Forestry,Kaiima,32746,KAIIMA BIO AGRITECH LTD,Active,NA,NA,NA,20,20
30.04.13,Cameroon,CAM,Financial Institutions,Activa Finances,31215,ACTIVA FINANCES LTD,Active,NA,NA,NA,5.7,5.7
30.04.13,Panama,PAN,Financial Institutions,Bandelta,32395,Banco Delta S.A.,Completed,NA,NA,6,NA,6
30.04.13,Chad,CHD,Health and Education,Chad Clinic,32607,CLINIQUE LA PROVIDENCE,Active,NA,NA,1.38,NA,1.38
30.04.13,Brazil,BRA,Financial Institutions,ABC Frontier,32730,BANCO ABC BRASIL SA,Completed,NA,NA,20,NA,20
30.04.13,Armenia,ARM,Financial Institutions,Unibank SME,33031,UNIBANK OJSC,Completed,NA,NA,5,NA,5
30.04.13,Ghana,GHA,Manufacturing,Ghana BDC II,33071,Chase Petroleum Ghana Limited,Completed,NA,75,NA,NA,75
30.04.13,Chile,CHL,Financial Institutions,Project Martina,33272,BANCO INTERNACIONAL SA,Completed,NA,NA,30,NA,30
29.04.13,Armenia,ARM,"Tourism, Retail, and Property",Property Development Company CJSC,32970,PROPERTY DEVELOPMENT COMPANY CJSC,Completed,NA,NA,10,NA,10
29.04.13,Albania,ALB,Infrastructure,Kurum International SH.A.,33378,KURUM INTERNATIONAL SH.A.,Active,NA,NA,44.91,NA,44.91
26.04.13,Honduras,HDS,Financial Institutions,Ficensa Loan,32992,Banco Financiera Centroamericana S.A.,Completed,NA,NA,10,NA,10
26.04.13,Georgia,GEO,Financial Institutions,FINCA GEORGIA,33331,FINCA BANK,Completed,NA,NA,4,NA,4
26.04.13,Brazil,BRA,"Telecommunications, Media, and Technology",Internexa Brazil,33334,Internexa Participacoes S A,Active,NA,NA,NA,25,25
26.04.13,World Region,WLD,Infrastructure,TPG Alternative and Renewable Technologies,33384,TPG Alternative and Renewable Technologies Partners L.P.,Active,NA,NA,NA,25,25
26.04.13,Brazil,BRA,Infrastructure,Vento Brazil,33642,CPFL ENERGIAS RENOVAVEIS S/A,Completed,NA,NA,NA,71.08,71.08
25.04.13,Bosnia and Herzegovina,BIH,Manufacturing,Bekto Precisa,32491,BEKTO-PRECISA D.O.O,Completed,NA,NA,10.39,NA,10.39
24.04.13,World Region,WLD,Agribusiness and Forestry,Olam Corp Loan,31566,OLAM INTERNATIONAL LIMITED,Completed,NA,NA,120,NA,120
24.04.13,Croatia,HRV,Infrastructure,Jelinak,32218,VJETROELEKTRANA JELINAK d.o.o.,Active,NA,NA,24.85,NA,24.85
24.04.13,Serbia,SRB,Infrastructure,Alibunar WPP,32752,ELECTRAWINDS-S D.O.O. BEOGRAD,Active,NA,NA,25.5,NA,25.5
24.04.13,Lao People's Democratic Republic,LAO,Financial Institutions,ACLEDA Lao Loan,32982,ACLEDA BANK LAO LTD,Completed,NA,NA,8,NA,8
23.04.13,Mozambique,MOZ,Manufacturing,Midal Cables Moz,32703,MIDAL CABLES INTERNATIONAL LIMITADA,Active,NA,NA,35,5,40
23.04.13,Turkey,TUR,Infrastructure,Asyaport,32902,ASYAPORT LIMAN ANONIM SIRKETI,Active,NA,NA,75,NA,75
23.04.13,Bangladesh,BAN,Financial Institutions,BRAC IMPACT VENTURES LIMITED,32909,BRAC IMPACT VENTURES LIMITED,Hold,NA,NA,NA,NA,NA
23.04.13,Indonesia,INS,Financial Institutions,BTPN Loan III,33212,PT BANK BTPN TBK,Completed,NA,NA,75,NA,75
22.04.13,China,CHA,Financial Institutions,"New Hope Agriculture and Food Fund II, L.P.",32694,New Hope Agriculture and Food Fund II LP,Active,NA,NA,NA,20,20
22.04.13,India,IND,Financial Institutions,Equitas ECB,33616,EQUITAS SMALL FINANCE BANK LIMITED,Active,NA,NA,10,NA,10
22.04.13,India,IND,Financial Institutions,Ujjivan ECB,33626,UJJIVAN FINANCIAL SERVICES LIMITED,Completed,NA,NA,10,NA,10
19.04.13,Peru,PER,Financial Institutions,Edyficar IV,32254,Empresa Financiera Edyficar S.A,Completed,NA,NA,40,NA,40
18.04.13,Mexico,MXC,Financial Institutions,ABC Capital SME,32952,"ABC Capital, S.A. Institución de Banca Múltiple",Pending Approval,NA,NA,15.63,NA,15.63
18.04.13,Georgia,GEO,Financial Institutions,BR Housing,33007,Bank Republic JSC,Active,NA,NA,20,NA,20
17.04.13,India,IND,Infrastructure,ACME Energy,32497,ACME SOLAR ENERGY (MADHYA PRADESH) PRIVATE LIMITED,Active,NA,NA,50,NA,50
16.04.13,Kazakhstan,KAZ,Financial Institutions,Sberbank KZ,31830,SB Sberbank JSC,Completed,NA,NA,70,NA,70
16.04.13,Dominican Republic,DOM,"Oil, Gas, and Mining",Unigold,32487,Unigold Inc,Completed,NA,NA,NA,12.36,12.36
16.04.13,Russian Federation,RUS,Financial Institutions,Multimortgage,33079,"KB DELTAKREDIT, AO",Completed,NA,NA,70,NA,70
15.04.13,Kosovo,XKS,Financial Institutions,TEB Kosovo Sh A Subordinated Loan,33510,TEB SH.A.,Completed,NA,NA,5.88,NA,5.88
15.04.13,India,IND,Financial Institutions,IBEF II,33540,INDIA BUSINESS EXCELLENCE FUND-IIA,Active,NA,NA,NA,25,25
12.04.13,Iraq,IRQ,"Tourism, Retail, and Property",Arjaan Erbil,32451,MALIA INVEST HOLDING SAL,Active,NA,NA,14,NA,14
10.04.13,Guinea,GUI,"Tourism, Retail, and Property",Palma Guinea,32408,PALMA GUINEE SA,Active,NA,NA,15,NA,15
10.04.13,Latin America Region,LAC,Health and Education,Santillana,32548,GRUPO SANTILLANA EDUCACION GLOBAL SL.,Active,NA,NA,32.51,NA,32.51
10.04.13,Ethiopia,ETH,Financial Institutions,GTST Ethiopia Trade Facility,32846,INDEPENDENT PETROLEUM GROUP K.S.C.P,Completed,NA,NA,75,NA,75
10.04.13,China,CHA,"Oil, Gas, and Mining",ENN Energy,33120,ENN Energy Holdings Limited,Completed,NA,NA,75,NA,75
09.04.13,China,CHA,Health and Education,QDJason Electric,32927,"QINGDAO JASON ELECTRIC CO.,LTD.",Completed,NA,NA,NA,6,6
09.04.13,Mongolia,MNG,Financial Institutions,TFG Equity 2013,33492,XACBANK LLC,Active,NA,NA,NA,7.35,7.35
08.04.13,Pakistan,PAK,"Tourism, Retail, and Property",G4 Office Tower,32873,IMPERIAL DEVELOPERS AND BUILDERS (PRIVATE) LIMITED,Pending Approval,NA,NA,11,NA,11
08.04.13,Bangladesh,BAN,Financial Institutions,WCSS AB Bank BSLF III,33243,AB BANK LIMITED.,Completed,NA,NA,35,NA,35
05.04.13,China,CHA,Financial Institutions,CFPA MFI Loan,33268,"CFPA MICROFINANCE MANAGEMENT CO., LTD.",Active,NA,NA,20,NA,20
05.04.13,Belarus,BLR,"Tourism, Retail, and Property",Rubliovskiy III,33389,MILLEX INTERNATIONAL LIMITED,Completed,NA,NA,20,NA,20
