date_disclosed,country,ifc_country_code,sector,project_name,project_number,company_name,status,ifc_investment_for_risk_management_million_usd,ifc_investment_for_guarantee_million_usd,ifc_investment_for_loan_million_usd,ifc_investment_for_equity_million_usd,total_ifc_investment_as_approved_by_board_million_usd
24.03.17,Senegal,SEN,Agribusiness and Forestry,Societe Industrielle Agro-Alimentaire S.A,39269,SOCIETE INDUSTRIELLE AGRO-ALIMENTAIRE S.A,Active,NA,NA,3.28,NA,3.28
22.03.17,China,CHA,Health and Education,Minsheng Edu,38573,MINSHENG EDUCATION GROUP COMPANY LIMITED,Active,NA,NA,70,30,100
21.03.17,India,IND,Funds,pi Ventures Investment Trust,39421,PI VENTURES INVESTMENT TRUST,Active,NA,NA,NA,30,30
21.03.17,Turkey,TUR,Health and Education,Nobel Ilac Sanayi ve Ticaret A.S.,39247,NOBEL ILAC SANAYII VE TICARET A.S.,Active,NA,NA,25,NA,25
15.03.17,"Egypt, Arab Republic of",EGT,"Oil, Gas, and Mining",Apex International Limited,38485,APEX INTERNATIONAL ENERGY L.P.,Active,NA,NA,NA,75,75
14.03.17,Ukraine,UKR,Funds,"Emerging Europe Growth Fund III, L.P.",38407,EMERGING EUROPE GROWTH FUND III LP,Active,NA,NA,NA,15,15
14.03.17,Ghana,GHA,Health and Education,Ashesi University II,39192,ASHESI UNIVERSITY COLLEGE,Active,NA,NA,10,NA,10
14.03.17,Brazil,BRA,Financial Institutions,Banco Industrial SME,39434,BANCO INDUSTRIAL DO BRASIL S.A.,Active,NA,NA,26.7,NA,26.7
13.03.17,Nigeria,NIR,Health and Education,Axa Hospital,38833,SANTA CLARA AFRICA LIMITED,Pending Approval,NA,NA,NA,8.5,8.5
09.03.17,East Asia and Pacific Region,EAP,Funds,Carlyle Asia Growth Partners V,39168,"CARLYLE ASIA GROWTH PARTNERS V, L.P.",Active,NA,NA,NA,25,25
07.03.17,Ukraine,UKR,Manufacturing,Ukrplastic,37450,"Ukrplastic,PAT",Active,NA,NA,18.35,NA,18.35
03.03.17,Southern Africa Region,AFS,"Tourism, Retail, and Property",NeltGroup Africa,38301,NELT AFRICA SPV,Pending Approval,NA,NA,NA,NA,NA
03.03.17,Ghana,GHA,Financial Institutions,Zenith Bk Ghana,39317,ZENITH BANK (GHANA) LTD,Active,NA,10,40,NA,50
01.03.17,World Region,WLD,"Telecommunications, Media, and Technology",ESIP Sigfox,39119,SIGFOX,Active,NA,NA,NA,16.41,16.41
01.03.17,Romania,ROM,Financial Institutions,Garanti Lease RO2,39287,MOTORACTIVE IFN SA,Active,NA,NA,5.87,NA,5.87
01.03.17,Brazil,BRA,Agribusiness and Forestry,Sao Martinho I,37809,SAO MARTINHO S/A.,Active,NA,NA,60,NA,60
27.02.17,El Salvador,ESL,Financial Institutions,Scotia El Salvad SME and Housing Loan,38771,SCOTIABANK EL SALVADOR SA,Completed,NA,NA,50,NA,50
27.02.17,Zambia,ZAM,Infrastructure,Great North Mall,38397,WOODSIDE MALL ZAMBIA LIMITED,Active,NA,NA,12.8,NA,12.8
23.02.17,Romania,ROM,Financial Institutions,WCSS Agricover,39197,AGRICOVER CREDIT IFN SA,Active,NA,NA,16.88,NA,16.88
23.02.17,India,IND,Financial Institutions,L&T GreenBond,37995,L AND T INFRASTRUCTURE FINANCE COMPANY LIMITED,Active,NA,NA,100,NA,100
23.02.17,India,IND,Agribusiness and Forestry,ETC India,39370,ETG AGRO PROCESSING (INDIA) PRIVATE LIMITED,Active,NA,NA,30.13,NA,30.13
21.02.17,Indonesia,INS,Health and Education,Quantum,39084,IDS Medical Systems Group Limited,Active,NA,NA,NA,60,60
17.02.17,Vietnam,VNM,Agribusiness and Forestry,PAN Farm,37130,PAN FARM JSC,Active,NA,NA,NA,10.11,10.11
17.02.17,India,IND,Health and Education,Granules III,38095,GRANULES INDIA LIMITED,Active,NA,NA,47.71,NA,47.71
16.02.17,Kosovo,XKS,Financial Institutions,KRK Senior Loan II,39206,KREDITIMI RURAL I KOSOVES LLC,Active,NA,NA,4.24,NA,4.24
16.02.17,Senegal,SEN,Infrastructure,Tobene IPP Phase 2,37808,TOBENE POWER SA,Active,0.75,NA,9.1,NA,9.85
13.02.17,India,IND,Infrastructure,Clean Max Equity,38331,CLEAN MAX ENVIRO ENERGY SOLUTIONS PRIVATE LIMITED,Active,NA,NA,NA,15,15
10.02.17,World Region,WLD,Manufacturing,Pilkington IV,38822,NSG UK ENTERPRISES LIMITED,Active,NA,NA,100,NA,100
07.02.17,Vietnam,VNM,Financial Institutions,VPBank Quasi-equity,39020,VIETNAM PROSPERITY JOINT STOCK COMMERCIAL BANK,Active,NA,NA,57,NA,57
06.02.17,World Region,WLD,other,LMRKTS Series A,39414,Lmrkts LLC,Active,NA,NA,NA,3,3
06.02.17,Solomon Islands,SLI,Agribusiness and Forestry,NFD Loan,38435,NATIONAL FISHERIES DEVELOPMENTS LTD,Active,NA,NA,15,NA,15
30.01.17,Kenya,KEN,Financial Institutions,Britam Kenya,37294,BRITAM HOLDINGS PLC,Active,NA,NA,NA,34.89,34.89
27.01.17,India,IND,Funds,IDG Ventures India Fund III LLC,39362,IDG VENTURES INDIA ADVISORS PRIVATE LIMITED,Active,NA,NA,NA,40,40
26.01.17,Bangladesh,BAN,Financial Institutions,WCS Dhaka Bank,35798,DHAKA BANK LTD.,Active,NA,NA,20,NA,20
25.01.17,West Bank and Gaza,XOT,Funds,ISC-Ibtikar Fund,39432,IBTIKAR FUND,Active,NA,NA,NA,30,30
25.01.17,Latin America Region,LAC,Infrastructure,Orazul Energia,38489,ORAZUL ENERGIA PARTNERS LLC,Active,NA,NA,NA,50,50
24.01.17,Mexico,MXC,Financial Institutions,Contigo I,38960,CEGE CAPITAL SAPI DE CV SOFOM ENR,Active,0.26,NA,6.93,NA,7.19
18.01.17,India,IND,Infrastructure,ESIP Blackbuck,39420,ZINKA LOGISTICS SOLUTIONS PRIVATE LIMITED,Active,NA,NA,NA,10,10
18.01.17,Argentina,ARG,Financial Institutions,CMF CL,38918,BANCO CMF S.A.,Active,NA,NA,40,NA,40
13.01.17,Zambia,ZAM,Infrastructure,SS Zambia 2,38685,NEOEN INTERNATIONAL,Active,3,NA,14,NA,17
12.01.17,Lao People's Democratic Republic,LAO,Financial Institutions,ABL Lao Kip II,39141,ACLEDA BANK LAO LTD,Active,NA,9.08,NA,NA,9.08
12.01.17,Greece,GRE,"Tourism, Retail, and Property",Grivalia Properties REIC,38285,GRIVALIA PROPERTIES REIC AE,Active,NA,NA,53.24,NA,53.24
09.01.17,South Africa,SOU,Agribusiness and Forestry,Bounty,38743,BOUNTY BRANDS,Active,NA,NA,22,NA,22
09.01.17,Morocco,MYC,Financial Institutions,DCM BCP Green Financing,38717,BANQUE CENTRALE POPULAIRE SA,Active,NA,NA,112.13,NA,112.13
06.01.17,Jordan,JOR,Infrastructure,Xenel Wind Jordan,35348,Abour Energy Company,Active,2,NA,28,NA,30
24.12.16,Brazil,BRA,Infrastructure,Loggi Technology International,39134,LOGGI TECHNOLOGY INTERNATIONAL,Active,NA,NA,NA,5,5
23.12.16,Mozambique,MOZ,Infrastructure,Nacala Corridor,34466,CORREDOR LOGISTICO INTEGRADO DE NACALA SA,Pending Approval,NA,NA,NA,NA,NA
23.12.16,Georgia,GEO,Health and Education,Aversi Pharma,37574,AVERSI-PHARMA LTD,Active,NA,NA,16.43,NA,16.43
22.12.16,Mexico,MXC,Agribusiness and Forestry,Norson II,37803,"Norson Holding, S. de R.L. de C.V.",Completed,NA,NA,14.01,NA,14.01
22.12.16,China,CHA,Infrastructure,Chint New Energy,38815,CHINT SOLAR (HONG KONG) COMPANY LIMITED,Active,NA,NA,50,NA,50
22.12.16,Brazil,BRA,Financial Institutions,Bankfacil BKF,39165,CREDITAS SOLUCOES FINANCEIRAS LTDA,Active,NA,NA,2.5,5,7.5
22.12.16,Indonesia,INS,Financial Institutions,BTPN MSME Loan,38934,PT BANK BTPN TBK,Active,NA,NA,100,NA,100
14.12.16,Cambodia,KAM,Financial Institutions,HKL senior 2017,39167,HATTHA KAKSEKAR LIMITED,Active,NA,NA,NA,NA,NA
14.12.16,Colombia,CLM,Financial Institutions,BCB GreenBondDCM,38731,BANCOLOMBIA SA,Active,NA,NA,117.12,NA,117.12
14.12.16,Guatemala,GUA,Financial Institutions,BI Regional,39011,Banco Industrial SA,Pending Approval,NA,NA,110,NA,110
13.12.16,Indonesia,INS,Financial Institutions,Radana Finance,38586,PT. RADANA BHASKARA FINANCE TBK,Active,1.5,NA,20,NA,21.5
10.12.16,Romania,ROM,Financial Institutions,Alpha Bank RO,38414,ALPHA BANK ROMANIA SA,Active,NA,NA,53.76,NA,53.76
07.12.16,Turkey,TUR,Health and Education,Elazig Health,38035,ELZ SAGLIK YATIRIM ANONIM SIRKETI,Active,NA,NA,87.64,NA,87.64
07.12.16,Bulgaria,BUL,Health and Education,AHG Bulgaria,38066,ACIBADEM CITY CLINIC B.V.,Active,NA,NA,NA,16.13,16.13
07.12.16,Benin,BEN,Financial Institutions,RSF Benin Tourism,38159,RSF Benin Tourism,Active,NA,20,NA,NA,20
03.12.16,Turkey,TUR,Funds,ATF I,36631,Abraaj Turkey Fund I LP,Active,NA,NA,NA,40,40
30.11.16,Argentina,ARG,Financial Institutions,Recargapay,36814,RECARGAPAY HOLDINGS INC.,Active,NA,NA,NA,7,7
30.11.16,Colombia,CLM,Financial Institutions,BMM Bond,38847,BANCO MUNDO MUJER SA,Active,NA,NA,27.66,NA,27.66
29.11.16,El Salvador,ESL,Financial Institutions,FDC III,37719,Federacion de Cajas de Credito y de Bancos de los Trabajadores SC de RL,Active,NA,NA,15,NA,15
29.11.16,World Region,WLD,Financial Institutions,Bayport,37771,BAYPORT MANAGEMENT LTD,Pending Approval,1,NA,NA,NA,1
28.11.16,Kenya,KEN,Financial Institutions,Kenya Commercial Bank Limited,36791,KCB GROUP LIMITED,Active,NA,NA,75,70,145
22.11.16,World Region,WLD,Funds,"SOSV III, L.P.",38299,"SOSV III, L.P.",Active,NA,NA,NA,30,30
22.11.16,Brazil,BRA,Health and Education,Intermedica,38612,NOTRE DAME INTERMEDICA SAUDE SA,Pending Approval,NA,NA,75,NA,75
22.11.16,Panama,PAN,Financial Institutions,Bandelta Sr. Loan II,38805,Banco Delta S.A.,Active,NA,NA,10,NA,10
18.11.16,Argentina,ARG,Agribusiness and Forestry,Los Grobo Equity,38193,GRUPO LOS GROBO LLC,Active,NA,NA,NA,50,50
18.11.16,Turkey,TUR,Financial Institutions,FIT Solutions,38569,FIT SOLUTIONS,Active,NA,NA,NA,5,5
17.11.16,"Egypt, Arab Republic of",EGT,Financial Institutions,AXA Egypt Insurance,36979,AXA EGYPT INVESTMENTS SAE,Active,NA,NA,NA,15.5,15.5
17.11.16,China,CHA,Infrastructure,GuiYang HuoCheBang,39207,GUIYANG HUOCHEBANG,Active,NA,NA,NA,15,15
15.11.16,Latin America Region,LAC,Funds,Jaguar RE Fund I,38939,JAGUAR REAL ESTATE PARTNERS L.P.,Active,NA,NA,NA,25,25
14.11.16,Mexico,MXC,Agribusiness and Forestry,Proteak Exp,38754,"PROTEAK UNO, S.A.B. DE C.V.",Active,NA,NA,37,NA,37
11.11.16,"Hong Kong SAR, China",HKG,Financial Institutions,CompareAsia,38728,COMPAREASIAGROUP CAPITAL LIMITED,Active,NA,NA,NA,15,15
09.11.16,Rwanda,RWA,Financial Institutions,WFP KCB Rwanda,37371,WFP PPP Rwanda Borrowers,Active,NA,1.22,NA,NA,1.22
08.11.16,Tanzania,TAN,Financial Institutions,WFP CRDB Tanzania,37374,WFP PPP Tanzania Borrowers RSF,Active,NA,2.91,NA,NA,2.91
07.11.16,Greece,GRE,Infrastructure,Greek Airports,37655,FRAPORT REGIONAL AIRPORTS OF GREECE A SOCIETE ANONYME,Active,6.5,NA,175.68,55.83,238.01
07.11.16,Greece,GRE,Infrastructure,Greek Airports B,38905,FRAPORT REGIONAL AIRPORTS OF GREECE B S.A.,Active,6.5,NA,175.68,55.83,238.01
03.11.16,Kenya,KEN,"Tourism, Retail, and Property",Maris: ALP,38583,AFRICA LOGISTICS PROPERTIES HOLDINGS LTD,Active,NA,NA,NA,10,10
02.11.16,Singapore,SNG,Funds,ISC Jungle SeedPlus,38844,SEEDPLUS SINGAPORE L.P.,Active,NA,NA,NA,30,30
27.10.16,Argentina,ARG,Funds,City of BA,38533,CIUDAD AUTONOMA DE BUENOS AIRES,Active,NA,NA,50,NA,50
27.10.16,World Region,WLD,Financial Institutions,Actis Energy 4,38809,ACTIS ENERGY FUND 4,Active,NA,NA,NA,50,50
24.10.16,Ghana,GHA,Financial Institutions,CAL Bank SME,38415,CAL BANK LIMITED,Active,NA,5,15,NA,20
24.10.16,Eastern Africa Region,EAN,Funds,Catalyst II,38648,"CATALYST FUND II, LLC",Active,NA,NA,NA,15,15
20.10.16,Poland,POL,Financial Institutions,BZ WBK green facility,38703,SANTANDER BANK POLSKA S.A.,Active,NA,NA,150,NA,150
18.10.16,Mexico,MXC,"Telecommunications, Media, and Technology",WaveCatcher,38474,Company Name Pending,Active,NA,NA,NA,40,40
18.10.16,Vietnam,VNM,Health and Education,VUS Training,38740,EAGLE HOLDINGS PTE LTD,Active,NA,NA,NA,10,10
12.10.16,Turkey,TUR,Financial Institutions,FinansL EE III,38496,QNB FINANS FINANSAL KIRALAMA ANONIM SIRKETI,Active,NA,NA,50,NA,50
11.10.16,Tanzania,TAN,Infrastructure,CTIF Mobisol Coinvest,38784,MOBISOL GMBH,Active,NA,NA,NA,5.94,5.94
03.10.16,China,CHA,Agribusiness and Forestry,Guangxi Yangxiang Co Ltd,38720,GUANGXI YANGXIANG CO LTD,Active,NA,NA,43.58,7.7,51.28
03.10.16,Eastern Africa Region,EAN,Funds,Fanisi Capital Fund II LLC,38752,FANISI CAPITAL FUND II LLC,Active,NA,NA,NA,250,250
29.09.16,Pakistan,PAK,Infrastructure,Tricon Boston Consulting Corporation Pvt. Limited,38229,TRICONBOSTON CONSULTING CORPORATION (PVT) LTD,Active,NA,NA,75,NA,75
29.09.16,Panama,PAN,Financial Institutions,DCM Multibank,38570,Multibank Inc.,Active,NA,NA,40,NA,40
23.09.16,Mali,MLI,Infrastructure,Segou Solaire,35853,SEGOU SOLAIRE SA,Pending Approval,5.28,NA,11.4,4.56,21.24
23.09.16,Argentina,ARG,Financial Institutions,Moni,38704,FINVEN LATAM INC,Active,NA,NA,NA,3,3
22.09.16,Uganda,UAN,Infrastructure,Umeme Capex II,38598,UMEME LTD,Active,NA,NA,25,NA,25
20.09.16,Brazil,BRA,Financial Institutions,Daycoval Gender,36812,Banco Daycoval S/A.,Active,NA,NA,75,NA,75
20.09.16,Burkina Faso,BUR,Infrastructure,Windiga BF,36857,ZINA SOLAIRE SA,Pending Approval,2.2,NA,10.32,NA,12.52
20.09.16,Madagascar,MAG,Infrastructure,Airports Madagascar,36882,Ravinala Airports,Active,10.65,NA,138.42,NA,149.07
20.09.16,Indonesia,INS,Manufacturing,PT Aneka Gas Industri Tbk,38908,"ANEKA GAS INDUSTRI, PT",Active,NA,NA,NA,11.04,11.04
15.09.16,China,CHA,Financial Institutions,PSBC Equity,35461,Postal Savings Bank of China,Active,NA,NA,NA,300,300
15.09.16,China,CHA,Funds,Maison China III,38818,MAISON CAPITAL FUND L.P.,Active,NA,NA,NA,20,20
09.09.16,Brazil,BRA,Financial Institutions,ABC Climate,37960,BANCO ABC BRASIL SA,Active,NA,NA,50,NA,50
09.09.16,Ukraine,UKR,Infrastructure,MV Cargo,37312,MV Cargo LLC,Active,NA,NA,37,NA,37
09.09.16,Myanmar,BUA,Agribusiness and Forestry,Bel Ga Myanmar,38236,BEL GA MYANMAR LIMITED,Active,NA,NA,7.5,NA,7.5
08.09.16,South Africa,SOU,Health and Education,Doppio,36211,ADVTECH LTD,Active,NA,NA,NA,20.93,20.93
08.09.16,Mongolia,MNG,"Tourism, Retail, and Property",Shangri-La UB 2,37908,SHANGRI-LA ULAANBAATAR HOTEL LLC,Active,NA,NA,75,NA,75
07.09.16,Myanmar,BUA,"Tourism, Retail, and Property",Amata Hotels,37848,UNITED INTERNATIONAL GROUP LIMITED,Active,NA,NA,13.5,NA,13.5
06.09.16,Africa Region,AFR,"Telecommunications, Media, and Technology",WIOCC Investment,38381,WEST INDIAN OCEAN CABLE COMPANY LTD,Active,NA,NA,20,NA,20
02.09.16,China,CHA,Financial Institutions,Baidu MCC Loan,38237,CHONGQING BAIDU MICROLOAN CO LTD,Active,NA,NA,73.82,NA,73.82
02.09.16,Colombia,CLM,Financial Institutions,BancompartirBond,38352,BANCO COMPARTIR S A,Hold,NA,NA,17.28,NA,17.28
02.09.16,Costa Rica,COS,Financial Institutions,Scotiabank Costa Rica SME and Housing Loan,38424,SCOTIABANK DE COSTA RICA SA,Active,NA,NA,75,NA,75
01.09.16,India,IND,Financial Institutions,Au Fin Debt,36838,AU SMALL FINANCE BANK LIMITED,Active,NA,NA,50,NA,50
29.08.16,Philippines,PHL,Funds,Sierra Madre Fund I,38633,SIERRA MADRE PHILIPPINES FUND I,Active,NA,NA,NA,15,15
26.08.16,Kenya,KEN,Health and Education,MCF Africa,37873,MEDICAL CREDIT FUND,Active,NA,NA,2.5,NA,2.5
25.08.16,Turkey,TUR,Financial Institutions,Akbank DPR 2,38166,AKBANK TURK ANONIM SIRKETI,Active,NA,NA,440,NA,440
24.08.16,Kenya,KEN,Agribusiness and Forestry,Tropical Heat,38225,TROPICAL HEAT LIMITED,Pending Approval,NA,NA,3,NA,3
23.08.16,India,IND,Infrastructure,HFE Equity,37910,HERO FUTURE ENERGIES PRIVATE LIMITED,Active,NA,NA,NA,62.5,62.5
19.08.16,Mexico,MXC,"Tourism, Retail, and Property",Vinte-NuEDGE,38374,"Promotora de Viviendas Integrales, S.A. de C.V.",Active,NA,NA,18.62,NA,18.62
18.08.16,World Region,WLD,Manufacturing,Yara Corporate,38320,Yara International ASA,Active,NA,NA,150,NA,150
18.08.16,Mexico,MXC,"Oil, Gas, and Mining",CalidraArgentina,38366,"Grupo Calidra, S.A. de C.V.",Completed,NA,NA,31.43,NA,31.43
17.08.16,Turkey,TUR,Financial Institutions,DCM Seker CB 2,38428,SEKERBANK TAS,Active,NA,NA,60,NA,60
16.08.16,China,CHA,Agribusiness and Forestry,Anyou II,36905,"Anyou Biotechnology Group Co.,Ltd.",Active,NA,NA,38.39,NA,38.39
15.08.16,China,CHA,Funds,Hosen Investment Fund III,38599,"HOSEN INVESTMENT FUND III, L.P.",Active,NA,NA,NA,30,30
15.08.16,China,CHA,Funds,Long Hill,38790,"LONG HILL CAPITAL VENTURE PARTNERS 1, L.P.",Active,NA,NA,NA,15,15
12.08.16,Latin America Region,LAC,Health and Education,SeniorAssist LAC,38334,SENIORITY CHILE SA,Active,NA,NA,NA,10,10
12.08.16,United Arab Emirates,UAE,Financial Institutions,Network Intl,38399,WP MERCURY HOLDINGS B.V.,Active,NA,NA,NA,17,17
08.08.16,Uzbekistan,UZB,Financial Institutions,ULI SME 2016,37749,JOINT-STOCK COMPANY UZBEK LEASING INTERNATIONAL AO,Active,NA,NA,5,NA,5
05.08.16,Turkey,TUR,Manufacturing,Martur,38025,MARTUR SUNGER VE KOLTUK TESISLERI TICARET VE SANAYI ANONIM SIRKETI,Active,NA,NA,NA,32.86,32.86
01.08.16,Belarus,BLR,"Tourism, Retail, and Property",Eurotorg,35769,Evrotorg OOO,Completed,NA,NA,NA,NA,NA
01.08.16,World Region,WLD,Financial Institutions,GTLP SCB III,38705,STANDARD CHARTERED PLC,Active,NA,NA,500,NA,500
28.07.16,Georgia,GEO,Financial Institutions,BGEO Bonds,38541,GEORGIA CAPITAL PLC,Active,NA,NA,70,NA,70
22.07.16,World Region,WLD,Financial Institutions,Remitly,36516,"Remitly, Inc.",Completed,NA,NA,NA,5,5
22.07.16,India,IND,Health and Education,Byju's,38562,THINK & LEARN PRIVATE LIMITED,Active,NA,NA,NA,15,15
18.07.16,Botswana,BOT,Financial Institutions,Botswana Building Society,35107,Botswana Building Society,Active,NA,NA,25,15,40
15.07.16,Jordan,JOR,Infrastructure,ACWA Power Zarqa Thermal Power Station,38207,MAHATAT AL ZARQA LE TAWLEED AL TAKAH AL KAHRABAIEYAH,Active,6,NA,75,NA,81
15.07.16,World Region,WLD,Funds,Capria Acc. Fund,38604,"CAPRIA ACELARATOR FUND, LP.",Completed,NA,NA,NA,250,250
13.07.16,Latin America Region,LAC,Funds,Certo S.A.,38523,CERTO S.A.,Active,NA,NA,NA,30,30
08.07.16,Argentina,ARG,"Telecommunications, Media, and Technology",Telecom Personal Argentina,36171,TELECOM ARGENTINA S.A.,Active,NA,NA,100,NA,100
08.07.16,China,CHA,Health and Education,Essex Bio,38104,ESSEX BIO-TECHNOLOGY LIMITED,Active,NA,NA,19.31,NA,19.31
07.07.16,Mexico,MXC,Agribusiness and Forestry,Bioparques 3,37826,"Bioparques de Occidente, S.A. de C.V.",Active,NA,NA,10,NA,10
01.07.16,Ghana,GHA,Financial Institutions,Fidelity A Loan,37327,Fidelity Bank Ghana Limited,Completed,NA,NA,NA,NA,NA
30.06.16,China,CHA,Agribusiness and Forestry,Muyuan Loan 3,38272,"MUYUAN FOOD CO., LTD.",Pending Approval,NA,NA,39.14,NA,39.14
29.06.16,Pakistan,PAK,Agribusiness and Forestry,CCI Pakistan,37922,COCA COLA BEVERAGES PAKISTAN LIMITED,Active,NA,NA,83.57,NA,83.57
29.06.16,Central America Region,XCN,"Tourism, Retail, and Property",ISCH III,38164,"INTERNATIONAL SHOPPING CENTERS HOLDINGS, INC-ISC",Active,NA,NA,45,NA,45
27.06.16,Turkey,TUR,Agribusiness and Forestry,Odeabank Equity,37925,ODEA BANK ANONIM SIRKETI,Active,NA,NA,NA,75,75
24.06.16,Armenia,ARM,Infrastructure,Vorotan Debt,37652,CONTOURGLOBAL HYDRO CASCADE CJSC,Active,2.9,NA,50,NA,52.9
17.06.16,Singapore,SNG,Financial Institutions,United Asia Loan Funding,36792,UOB ASSET MANAGEMENT LTD,Pending Approval,NA,NA,NA,NA,NA
15.06.16,India,IND,Health and Education,Glenmark,38371,GLENMARK PHARMACEUTICALS LIMITED,Active,NA,NA,75,NA,75
09.06.16,Latin America Region,LAC,Financial Institutions,LAAD IV,37802,LATIN AMERICAN AGRIBUSINESS DEVELOPMENT CORP SA,Active,NA,NA,50,NA,50
09.06.16,Kenya,KEN,Financial Institutions,Equity Bank II,38419,EQUITY GROUP HOLDINGS PLC,Active,NA,NA,82.5,NA,82.5
06.06.16,Pakistan,PAK,Funds,Abraaj Pakistan,37484,ABRAAJ PAKISTAN FUND I L.P.,Active,NA,NA,NA,20,20
03.06.16,India,IND,"Tourism, Retail, and Property",FCEL,37943,FUTURE CONSUMER LIMITED,Active,NA,NA,0,19.92,19.92
02.06.16,Turkey,TUR,Infrastructure,Akfen Energy,36772,AKFEN YENILENEBILIR ENERJI A.S.,Active,NA,NA,NA,100,100
02.06.16,"Egypt, Arab Republic of",EGT,Funds,Algebra Ventures Fund I,37639,ALGEBRA VENTURES,Active,NA,NA,NA,10,10
02.06.16,Costa Rica,COS,Financial Institutions,Davivienda CR II,38501,Banco Davivienda (Costa Rica) S.A.,Active,NA,NA,30,NA,30
01.06.16,Vietnam,VNM,Agribusiness and Forestry,Bel Ga JSC,38011,BEL GA JSC,Active,NA,NA,4,NA,4
01.06.16,Thailand,THL,Financial Institutions,TMB SF,38574,TMB BANK PUBLIC COMPANY LIMITED,Hold,NA,NA,NA,NA,NA
27.05.16,Bangladesh,BAN,Infrastructure,Summit Mezzanine,37593,SUMMIT POWER INTERNATIONAL PTE LTD,Active,NA,NA,65,0,65
24.05.16,South Africa,SOU,Health and Education,Ascendis,38257,ASCENDIS HEALTH LIMITED,Active,NA,NA,NA,30,30
19.05.16,India,IND,Health and Education,Apollo Specialty,37895,APOLLO HEALTH AND LIFESTYLE LIMITED,Active,NA,NA,NA,33.34,33.34
17.05.16,Brazil,BRA,Agribusiness and Forestry,Cerradinho Bio,35523,CERRADINHO BIOENERGIA SA,Active,NA,NA,49,NA,49
17.05.16,Myanmar,BUA,"Telecommunications, Media, and Technology",Irrawaddy Towers,35935,IRRAWADDY GREEN TOWERS LTD,Pending Approval,NA,NA,42.5,10,52.5
17.05.16,Argentina,ARG,Agribusiness and Forestry,Adeco Agropecuaria Argentina,36054,ADECO AGROPECUARIA S.A.,Active,NA,NA,50,NA,50
17.05.16,Poland,POL,Financial Institutions,Zachodni WBK,38099,SANTANDER LEASING S.A.,Active,NA,NA,150,NA,150
16.05.16,India,IND,Financial Institutions,Grameen Koota Financial Services,35181,CREDITACCESS GRAMEEN LIMITED,Active,NA,NA,20,NA,20
16.05.16,Bosnia and Herzegovina,BIH,Manufacturing,SSL Bosnia IV,37515,SISECAM SODA LUKAVAC DOO,Active,NA,NA,10,NA,10
13.05.16,South Africa,SOU,Agribusiness and Forestry,Number Two Piggeries (Pty) Ltd,37907,NUMBER TWO PIGGERIES (PROPRIETARY) LIMITED,Pending Approval,NA,NA,NA,NA,NA
13.05.16,Senegal,SEN,Infrastructure,CG CdB II,38113,CG CAP DES BICHES SENEGAL,Active,4,NA,NA,NA,4
13.05.16,Myanmar,BUA,"Tourism, Retail, and Property",Oway Group,38400,OWAY COMPANY LIMITED,Active,NA,NA,NA,2,2
11.05.16,Eastern Africa Region,EAN,Agribusiness and Forestry,Nespresso East African Coffee Project,36083,NESPRESSO SUSTAINABILITY INNOVATION FUND,Completed,NA,NA,3,NA,3
11.05.16,Latin America Region,LAC,Funds,Abraaj ALAF II,38042,COLONY LATIN AMERICA FUND II L.P.,Active,NA,NA,NA,20,20
09.05.16,Western Africa Region,WAN,Funds,Oasis AfricaFund,37988,OASIS AFRICA VC FUND LIMITED,Active,NA,NA,NA,250,250
06.05.16,Mexico,MXC,Manufacturing,Cemex Green,37840,"CEMEX, S.A.B. DE C.V",Completed,NA,NA,120,NA,120
06.05.16,Cambodia,KAM,Funds,CLMDF II,37898,CAMBODIA-LAOS-MYANMAR DEVELOPMENT FUND II LP,Active,NA,NA,NA,250,250
05.05.16,"Egypt, Arab Republic of",EGT,Infrastructure,Delta Solar,37636,DELTA FOR RENEWABLE ENERGY SAE,Active,1,NA,19,NA,20
05.05.16,"Egypt, Arab Republic of",EGT,Infrastructure,Taqa Arabia Solar,37637,TAQA ARABIA FOR SOLAR ENERGY S.A.E.,Active,1,NA,23,NA,24
05.05.16,"Egypt, Arab Republic of",EGT,Infrastructure,SECI Benban 3 Winnergy,37713,WINNERGY FOR RENEWABLE ENERGY PROJECTS S.A.E.,Active,0.5,NA,21,NA,21.5
04.05.16,"Egypt, Arab Republic of",EGT,Infrastructure,SECI-DT Benban 1 - ARC,37580,ARC FOR RENEWABLE ENERGY SAE,Active,1,NA,23,NA,24
04.05.16,"Egypt, Arab Republic of",EGT,Infrastructure,Phoenix Power1,37591,PHOENIX POWER 1 SAE,Active,1,NA,24,NA,25
04.05.16,"Egypt, Arab Republic of",EGT,Infrastructure,Alcazar Solar 1,37633,ALCAZAR ENERGY EGYPT SOLAR 1,Active,1,NA,19,NA,20
03.05.16,India,IND,Financial Institutions,Repco HFL,37630,REPCO HOME FINANCE LIMITED,Active,NA,NA,40,NA,40
29.04.16,Cote d'Ivoire,IVC,Financial Institutions,SIMPA CI,38053,SOCIETE INDUSTRIELLE MODERNE DES PLASTIQUES AFRICAINS SA,Active,NA,NA,16.73,NA,16.73
29.04.16,Eastern Europe Region,EER,Agribusiness and Forestry,Soufflet LT,38083,SOUFFLET FINANCES,Active,NA,NA,34.19,NA,34.19
28.04.16,Ukraine,UKR,Agribusiness and Forestry,Astarta FMO loan,38157,"ASTARTA-KYIV,TOV",Completed,NA,NA,10,NA,10
27.04.16,Mexico,MXC,Financial Institutions,Vector Mezzanine Mexico Uno,38101,"MEZZANINE MEXICO UNO, S.A.P.I. DE C.V., SOFOM, E.N.R.",Active,NA,NA,22.65,NA,22.65
27.04.16,Pakistan,PAK,Agribusiness and Forestry,Anagram Equity,38150,Koninklijke FrieslandCampina N.V.,Active,NA,NA,111.52,44.61,156.13
27.04.16,Zambia,ZAM,Financial Institutions,Zoona,38220,ZOONA TRANSACTIONS INTERNATIONAL LTD,Active,NA,NA,NA,6,6
26.04.16,"Egypt, Arab Republic of",EGT,"Tourism, Retail, and Property",Hassan Allam 1,37831,HASSAN ALLAM CONSTRUCTION,Pending Approval,NA,NA,10,20,30
25.04.16,Iraq,IRQ,Manufacturing,Karbala Cement Manufacturing Limited,32206,KARBALA CEMENT MANUFACTURING LTD.,Completed,NA,NA,100,50,150
25.04.16,Vietnam,VNM,Financial Institutions,TPB Quasi Equity,37920,TIEN PHONG COMMERCIAL JOINT STOCK BANK,Active,NA,NA,NA,18.35,18.35
25.04.16,Lebanon,LEB,Financial Institutions,Vitas Leb II,38049,VITAS SAL,Active,NA,NA,4,NA,4
25.04.16,Ukraine,UKR,Agribusiness and Forestry,Agrofusion WC Loan,38058,FE INTEGRATED AGROSYSTEMS,Active,NA,NA,10,NA,10
25.04.16,Africa Region,AFR,Financial Institutions,ALCB Fund,38139,AFRICAN LOCAL CURRENCY BOND FUND LIMITED,Active,NA,NA,20,NA,20
22.04.16,Turkey,TUR,Manufacturing,Assan Aluminium,37550,ASSAN ALUMINYUM SANAYI VE TICARET ANONIM SIRKETI,Active,NA,NA,56.99,NA,56.99
22.04.16,Argentina,ARG,Financial Institutions,PATAGONIA CL II,38119,BANCO PATAGONIA S.A.,Active,NA,NA,50,NA,50
22.04.16,Latin America Region,LAC,Funds,500 Mexico II,38263,500 LUCHADORES II LP,Active,NA,NA,NA,30,30
21.04.16,West Bank and Gaza,XOT,Financial Institutions,Faten II,35149,PALESTINE FOR CREDIT AND DEVELOPMENT,Active,NA,NA,5,NA,5
21.04.16,World Region,WLD,Financial Institutions,DARP Global AGM,37035,Seta Holdco S.A R.L.,Active,NA,NA,462.5,37.5,500
20.04.16,Georgia,GEO,Health and Education,Georgia Healthcare Group,37824,GEORGIA HEALTHCARE GROUP JSC,Active,NA,NA,25,NA,25
19.04.16,Montenegro,MNE,Financial Institutions,Alter Modus,37435,ALTER MODUS D.O.O.,Active,NA,NA,4.46,NA,4.46
14.04.16,India,IND,Health and Education,Regency Hospital,35989,REGENCY HOSPITAL LIMITED,Active,NA,NA,NA,9.07,9.07
14.04.16,Argentina,ARG,Financial Institutions,Galicia CL III,38134,BANCO DE GALICIA Y BUENOS AIRES S.A.,Active,NA,NA,130,NA,130
13.04.16,Myanmar,BUA,Financial Institutions,Maha MicroFinance,38031,MAHA AGRICULTURE PUBLIC COMPANY LIMITED,Active,NA,NA,2,1.5,3.5
13.04.16,Vietnam,VNM,Financial Institutions,VPBank Senior Loan,38038,VIETNAM PROSPERITY JOINT STOCK COMMERCIAL BANK,Active,NA,NA,50,NA,50
13.04.16,"Egypt, Arab Republic of",EGT,Funds,Flat6Labs Accelerator Company S.A.E.,38087,FLAT6LABS ACCELERATOR FOR IT AND PROJECT MANAGEMENT SAE,Active,NA,NA,NA,30,30
13.04.16,Mongolia,MNG,Financial Institutions,Khan Bank Syndication Loan,38121,KHAN BANK LLC,Active,NA,NA,40,NA,40
12.04.16,India,IND,Funds,Plenty Fund I,37348,PLENTY PRIVATE EQUITY FUND I LIMITED,Active,NA,NA,NA,25.4,25.4
12.04.16,South Africa,SOU,Financial Institutions,Nelson,37402,NET 1 UEPS TECHNOLOGIES INC.,Active,NA,NA,NA,30,30
11.04.16,India,IND,Financial Institutions,HFC Facility,37555,MOTILAL OSWAL HOME FINANCE LIMITED,Pending Approval,NA,NA,37.53,NA,37.53
